<t:root xmlns:t="test"
        xmlns:o="other"
        xmlns:xsi="http://www.w3.org/2001/XMLSchema-instance"
        xsi:schemaLocation="test test.xsd">

  <choice>
    <a>a</a>

    <b>b</b>
  </choice>

  <choice>
    <c>c</c>
    <d>d</d>

    <o:any>any</o:any>

    <a>a</a>
  </choice>

  <choice>
    <c>c</c>
    <d>d</d>

    <d>d</d>

    <a>a</a>
  </choice>

</t:root>
